Rank,System,Cores,Rmax (PFlop/s),Rpeak (PFlop/s),Power (kW)
1,"Supercomputer Fugaku - Supercomputer Fugaku, A64FX 48C 2.2GHz, Tofu interconnect D,                 Fujitsu                RIKEN Center for Computational ScienceJapan",7630848,442.01,537.21,29899
2,"Summit - IBM Power System AC922, IBM POWER9 22C 3.07GHz, NVIDIA Volta GV100, Dual-rail Mellanox EDR Infiniband,                 IBM                DOE/SC/Oak Ridge National LaboratoryUnited States",2414592,148.6,200.79,10096
3,"Sierra - IBM Power System AC922, IBM POWER9 22C 3.1GHz, NVIDIA Volta GV100, Dual-rail Mellanox EDR Infiniband,                 IBM / NVIDIA / Mellanox                DOE/NNSA/LLNLUnited States",1572480,94.64,125.71,7438
4,"Sunway TaihuLight - Sunway MPP, Sunway SW26010 260C 1.45GHz, Sunway,                 NRCPC                National Supercomputing Center in WuxiChina",10649600,93.01,125.44,15371
5,"Perlmutter - HPE Cray EX235n, AMD EPYC 7763 64C 2.45GHz, NVIDIA A100 SXM4 40 GB, Slingshot-10,                 HPE                DOE/SC/LBNL/NERSCUnited States",706304,64.59,89.79,2528
6,"Selene - NVIDIA DGX A100, AMD EPYC 7742 64C 2.25GHz, NVIDIA A100, Mellanox HDR Infiniband,                 Nvidia                NVIDIA CorporationUnited States",555520,63.46,79.22,2646
7,"Tianhe-2A - TH-IVB-FEP Cluster, Intel Xeon E5-2692v2 12C 2.2GHz, TH Express-2, Matrix-2000,                 NUDT                National Super Computer Center in GuangzhouChina",4981760,61.44,100.68,18482
8,"JUWELS Booster Module - Bull Sequana XH2000 , AMD EPYC 7402 24C 2.8GHz, NVIDIA A100, Mellanox HDR InfiniBand/ParTec ParaStation ClusterSuite,                 Atos                Forschungszentrum Juelich (FZJ)Germany",449280,44.12,70.98,1764
9,"HPC5 - PowerEdge C4140, Xeon Gold 6252 24C 2.1GHz, NVIDIA Tesla V100, Mellanox HDR Infiniband,                 DELL EMC                Eni S.p.A.Italy",669760,35.45,51.72,2252
10,"Frontera - Dell C6420, Xeon Platinum 8280 28C 2.7GHz, Mellanox InfiniBand HDR,                 DELL EMC                Texas Advanced Computing Center/Univ. of TexasUnited States",448448,23.52,38.75,
11,"Dammam-7 - Cray CS-Storm, Xeon Gold 6248 20C 2.5GHz, NVIDIA Tesla V100 SXM2, InfiniBand HDR 100,                 HPE                Saudi AramcoSaudi Arabia",672520,22.4,55.42,
12,"ABCI 2.0 - PRIMERGY GX2570 M6, Xeon Platinum 8360Y 36C 2.4GHz, NVIDIA A100 SXM4 40 GB, Infiniband HDR,                 Fujitsu                National Institute of Advanced Industrial Science and Technology (AIST)Japan",504000,22.21,54.34,1600
13,"Wisteria/BDEC-01 (Odyssey) - PRIMEHPC FX1000, A64FX 48C 2.2GHz, Tofu interconnect D,                 Fujitsu                Information Technology Center, The University of TokyoJapan",368640,22.12,25.95,1468
14,"Marconi-100 - IBM Power System AC922, IBM POWER9 16C 3GHz, Nvidia Volta V100, Dual-rail Mellanox EDR Infiniband,                 IBM                CINECAItaly",347776,21.64,29.35,1476
15,"Piz Daint - Cray XC50, Xeon E5-2690v3 12C 2.6GHz, Aries interconnect , NVIDIA Tesla P100,                 Cray/HPE                Swiss National Supercomputing Centre (CSCS)Switzerland",387872,21.23,27.15,2384
16,"Trinity - Cray XC40, Xeon E5-2698v3 16C 2.3GHz, Intel Xeon Phi 7250 68C 1.4GHz, Aries interconnect,                 Cray/HPE                DOE/NNSA/LANL/SNLUnited States",979072,20.16,41.46,7578
17,"SuperMUC-NG - ThinkSystem SD650, Xeon Platinum 8174 24C 3.1GHz, Intel Omni-Path,                 Lenovo                Leibniz RechenzentrumGermany",305856,19.48,26.87,
18,"Hawk - Apollo 9000, AMD EPYC 7742 64C 2.25GHz, Mellanox HDR Infiniband,                 HPE                HLRS - Höchstleistungsrechenzentrum StuttgartGermany",698880,19.33,25.16,3906
19,"Ghawar-1 - HPE Cray EX, AMD EPYC 7702 64C 2GHz, Slingshot-10,                 HPE                Saudi AramcoSaudi Arabia",714240,19.26,22.86,
20,"Lassen - IBM Power System AC922, IBM POWER9 22C 3.1GHz, Dual-rail Mellanox EDR Infiniband, NVIDIA Tesla V100,                 IBM / NVIDIA / Mellanox                DOE/NNSA/LLNLUnited States",288288,18.2,23.05,
21,"PANGEA III - IBM Power System AC922, IBM POWER9 18C 3.45GHz, Dual-rail Mellanox EDR Infiniband, NVIDIA Volta GV100,                 IBM                Total Exploration ProductionFrance",291024,17.86,25.03,1367
22,"HiPerGator AI - NVIDIA DGX A100, AMD EPYC 7742 64C 2.25GHz, NVIDIA A100, Infiniband HDR,                 Nvidia                University of FloridaUnited States",138880,17.2,21.31,583
23,"Maru - ThinkSystem SD650 V2, Xeon Platinum 8368Q 38C 2.6GHz, Infiniband HDR,                 Lenovo                Korea Meteorological AdministrationSouth Korea",306432,16.75,25.5,15414
24,"Guru - ThinkSystem SD650 V2, Xeon Platinum 8368Q 38C 2.6GHz, Infiniband HDR,                 Lenovo                Korea Meteorological AdministrationSouth Korea",306432,16.75,25.5,15414
25,"TOKI-SORA - PRIMEHPC FX1000, A64FX 48C 2.2GHz, Tofu interconnect D,                 Fujitsu                Japan Aerospace eXploration AgencyJapan",276480,16.59,19.46,
26,"Pioneer-EUS - NDv4 cluster, AMD EPYC 7V12 48C 2.45GHz, NVIDIA A100, Infiniband HDR,                 Microsoft Azure                Azure East USUnited States",157440,16.59,24.56,
27,"Pioneer-SCUS - NDv4 cluster, AMD EPYC 7V12 48C 2.45GHz, NVIDIA A100, Infiniband HDR,                 Microsoft Azure                Azure South Central USUnited States",157440,16.59,24.56,
28,"Pioneer-WEU - NDv4 cluster, AMD EPYC 7V12 48C 2.45GHz, NVIDIA A100, Infiniband HDR,                 Microsoft Azure                Azure West EuropeNetherlands",157440,16.59,24.56,
29,"Pioneer-WUS2 - NDv4 cluster, AMD EPYC 7V12 48C 2.45GHz, NVIDIA A100, Infiniband HDR,                 Microsoft Azure                Azure West US 2United States",157440,16.59,24.56,
30,"Cori - Cray XC40, Intel Xeon Phi 7250 68C 1.4GHz, Aries interconnect ,                 Cray/HPE                DOE/SC/LBNL/NERSCUnited States",622336,14.01,27.88,3939
31,"Nurion - Cray CS500, Intel Xeon Phi 7250 68C 1.4GHz, Intel Omni-Path,                 Cray/HPE                Korea Institute of Science and Technology InformationSouth Korea",570020,13.93,25.71,
32,"Oakforest-PACS - PRIMERGY CX1640 M1, Intel Xeon Phi 7250 68C 1.4GHz, Intel Omni-Path,                 Fujitsu                Joint Center for Advanced High Performance ComputingJapan",556104,13.55,24.91,2719
33,"HPC4 - Proliant DL380 Gen10, Xeon Platinum 8160  24C 2.1GHz, Mellanox InfiniBand EDR, NVIDIA Tesla P100,                 HPE                Eni S.p.A.Italy",253600,12.21,18.62,1320
34,"Tera-1000-2 - Bull Sequana X1000, Intel Xeon Phi 7250 68C 1.4GHz, Bull BXI 1.2,                 Atos                Commissariat a l'Energie Atomique (CEA)France",561408,11.97,23.4,3178
35,"Stampede2 - PowerEdge C6320P/C6420, Intel Xeon Phi 7250 68C 1.4GHz/Platinum 8160, Intel Omni-Path,                 DELL EMC                Texas Advanced Computing Center/Univ. of TexasUnited States",367024,10.68,18.31,
36,"MeluXina - Accelerator Module - BullSequana XH2000, AMD EPYC 7452 32C 2.35GHz, NVIDIA A100 40GB, Mellanox HDR InfiniBand/ParTec ParaStation ClusterSuite,                 Atos                LuxProvideLuxembourg",99200,10.52,15.29,390
37,"Cactus - HPE Cray EX, AMD EPYC 7742 64C 2.25GHz, Slingshot-10,                 HPE                GDIT/NOAA/WCOSSUnited States",327680,10.01,11.8,
38,"Dogwood - HPE Cray EX, AMD EPYC 7742 64C 2.25GHz, Slingshot-10,                 HPE                GDIT/NOAA/WCOSSUnited States",327680,10.01,11.8,
39,"Earth Simulator -SX-Aurora TSUBASA - SX-Aurora TSUBASA B401-8, Vector Engine Type20B 8C 1.6GHz, Infiniband HDR200,                 NEC                Japan Agency for Marine-Earth Science and TechnologyJapan",43776,9.99,13.45,1391
40,"Amazon EC2 Instance Cluster us-east-1a - Amazon EC2 r5.24xlarge, Xeon Platinum 8260 24C 2.4GHz, 25G Ethernet,                 Amazon Web Services                Descartes LabsUnited States",172692,9.95,15.11,
41,"NVIDIA Cambridge-1 DGX SuperPOD - NVIDIA DGX A100, AMD EPYC 7742 64C 2.25GHz, NVIDIA A100 80GB​, Infiniband HDR,                 Nvidia                NVIDIA CorporationUnited States",79360,9.68,12.05,
42,"DGX SuperPOD - NVIDIA DGX-2H, Xeon Platinum 8174 24C 3.1GHz, NVIDIA Tesla V100, Mellanox InfiniBand EDR,                 Nvidia                NVIDIA CorporationUnited States",127488,9.44,11.21,
43,"JURECA Data Centric Module - BullSequana XH2000, AMD EPYC 7742 64C 2.25GHz, NVIDIA A100 40GB, Mellanox HDR InfiniBand/ParTec ParaStation ClusterSuite,                 Atos                Forschungszentrum Juelich (FZJ)Germany",105840,9.33,14.51,384
44,"Gadi - PRIMERGY CX2570 M5, ThinkSystem SD650, Xeon Platinum 8274/8268, NVIDIA Tesla V100 SXM2, Mellanox HDR Infiniband,                 Fujitsu / Lenovo                National Computational Infrastructure (NCI Australia)Australia",204032,9.26,15.14,
45,"Taiwania 2 - QCT QuantaGrid D52G-4U/LC, Xeon Gold 6154 18C 3GHz, Mellanox InfiniBand EDR, NVIDIA Tesla V100 SXM2,                 Quanta Computer / Taiwan Fixed Network / ASUS Cloud                National Center for High Performance ComputingTaiwan",170352,9.0,15.21,798
46,"Dragão - Supermicro SYS-4029GP-TVRT, Xeon Gold 6230R 26C 2.1GHz, NVIDIA Tesla V100, Infiniband EDR,                 Atos                Petróleo Brasileiro S.ABrazil",188224,8.98,14.01,943
47,"Raven-GPU - ThinkSystem SD650-N V2, Xeon Platinum 8360Y 36C 2.4GHz, NVIDIA A100, Mellanox HDR Infiniband,                 Lenovo                Max-Planck-Gesellschaft MPI/IPPGermany",96768,8.62,16.03,377
48,"AiMOS - IBM Power System AC922, IBM POWER9 20C 3.45GHz, NVIDIA Volta GV100, Dual-rail Mellanox EDR Infiniband,                 IBM                Rensselaer Polytechnic Institute Center for Computational Innovations (CCI)United States",130000,8.34,11.03,512
49,"Taranis - Bull Sequana XH2000 , AMD EPYC 7742 64C 2.25GHz, Mellanox InfiniBand HDR100,                 Atos                Meteo FranceFrance",294912,8.19,10.32,1672
50,"TSUBAME3.0 - SGI ICE XA, IP139-SXM2, Xeon E5-2680v4 14C 2.4GHz, Intel Omni-Path, NVIDIA Tesla P100 SXM2,                 HPE                GSIC Center, Tokyo Institute of TechnologyJapan",135828,8.12,12.13,792
51,"Roxy - Apollo 2000, Xeon Gold 6248 20C 2.5GHz, Infiniband EDR,                 HPE                GovernmentUnited States",174720,8.12,13.98,
52,"HoreKa-Green - ThinkSystem SD650 V2, Xeon Platinum 8368 38C 2.4GHz, NVIDIA A100 40GB, Mellanox HDR Infiniband,                 Lenovo                Karlsruher Institut für Technologie (KIT) Germany",90932,8.03,15.01,359
53,"Narwhal - HPE Cray EX, AMD EPYC 7H12 64C 2.6GHz, Slingshot-10,                 HPE                Navy DSRCUnited States",276480,8.02,11.5,
54,"Plasma Simulator - SX-Aurora TSUBASA A412-8, Vector Engine Type10AE 8C 1.58GHz, Infiniband HDR 200,                 NEC                National Institute for Fusion Science (NIFS)Japan",34560,7.89,10.51,1550
55,"Belenos - Bull Sequana XH2000 , AMD EPYC 7742 64C 2.25GHz, Mellanox HDR100,                 Atos                Meteo FranceFrance",294912,7.68,10.47,1655
56,"PupMaya - Apollo 2000, Xeon Gold 6148 20C 2.4GHz, Infiniband EDR,                 HPE                GovernmentUnited States",169920,7.48,12.9,
57,"Artemis - NVIDIA DGX-2, Xeon Platinum 8168 24C 2.7GHz, Infiniband EDR, NVIDIA Tesla V100,                 Nvidia                Group 42United Arab Emirates",107568,7.26,9.49,673
58,"Cray XC40, Xeon E5-2695v4 18C 2.1GHz, Aries interconnect ,                 Cray/HPE                United Kingdom Meteorological OfficeUnited Kingdom",241920,7.04,8.13,
59,"JOLIOT-CURIE ROME - Bull Sequana XH2000 , AMD Rome 7H12 64C 2.6GHz, Mellanox HDR100,                 Atos                CEA/TGCC-GENCIFrance",197120,6.99,12.04,1436
60,"Theta - Cray XC40, Intel Xeon Phi 7230 64C 1.3GHz, Aries interconnect ,                 Cray/HPE                DOE/SC/Argonne National LaboratoryUnited States",280320,6.92,11.66,
61,"Christofari - NVIDIA DGX-2, Xeon Platinum 8168 24C 2.7GHz, Mellanox InfiniBand EDR, NVIDIA Tesla V100,                 Nvidia                SberCloudRussia",99600,6.67,8.79,
62,"Flow - PRIMEHPC FX1000, A64FX 48C 2.2GHz, Tofu interconnect D,                 Fujitsu                Information Technology Center, Nagoya UniversityJapan",110592,6.62,7.79,
63,"MareNostrum - Lenovo SD530, Xeon Platinum 8160 24C 2.1GHz, Intel Omni-Path,                 Lenovo                Barcelona Supercomputing CenterSpain",153216,6.47,10.3,1632
64,"ONYX - Cray XC40, Xeon E5-2699v4  22C 2.2GHz, Aries interconnect ,                 Cray/HPE                ERDC DSRCUnited States",211816,6.32,7.46,
65,"JUWELS Module 1 - Bull Sequana X1000, Xeon Platinum 8168 24C 2.7GHz, Mellanox EDR InfiniBand/ParTec ParaStation ClusterSuite,                 Atos                Forschungszentrum Juelich (FZJ)Germany",114480,6.18,9.89,1361
66,"HPE SGI 8600, Xeon Gold 6248R 24C 3GHz, NVIDIA Tesla V100 SXM2, Infiniband EDR,                 HPE                Japan Atomic Energy Agency(JAEA)/ National Institutes for Quantum and Radiological Science and Technology(QST)Japan",100096,6.16,8.44,
67,"SQUID - CPU Nodes - NEC LX 103Bj-8, Xeon Platinum 8368 38C 2.4GHz, Infiniband HDR200,                 NEC                Osaka UniversityJapan",115520,6.11,8.87,1222
68,"Lise - Bull intel Cluster, Intel Xeon Platinum 9242 48C 2.3GHz, Intel Omni-Path,                 Atos                HLRN at ZIB/Konrad Zuse-Zentrum BerlinGermany",121920,6.05,8.93,
69,"Karolina, GPU partition - Apollo 6500, AMD EPYC 7452 32C 2.35GHz, NVIDIA A100 SXM4 40 GB, Infiniband HDR200,                 HPE                IT4Innovations National Supercomputing Center, VSB-Technical University of OstravaCzechia",64960,6.05,8.65,297
70,"Pleiades - SGI ICE X, Intel Xeon E5-2670/E5-2680v2/E5-2680v3/E5-2680v4  2.6/2.8/2.5/2.4 GHz, Infiniband FDR,                 HPE                NASA/Ames Research Center/NASUnited States",241108,5.95,7.11,4407
71,"Emmy+ - BullSequana X, Intel Xeon Platinum 9242/Gold 6148, Intel Omni-Path,                 Atos                HLRN+ at GWDG/University of GöttingenGermany",120296,5.95,8.91,
72,"Aitken - HPE Apollo 9000/HPE SGI 8600, AMD EPYC 7742 64C 2.25GHz/Intel Xeon Gold 6248 20C 2.5GHz, Mellanox EDR/HDR Infiniband,                 HPE                NASA/Ames Research Center/NASUnited States",175648,5.8,8.33,1401
73,"Sawtooth - HPE SGI 8600, Xeon Platinum 8268 24C 2.9GHz, Infiniband EDR/HDR ,                 HPE                Idaho National LaboratoryUnited States",99792,5.78,9.22,1432
74,"Cray XC50, Xeon Platinum 8160  24C 2.1GHz, Aries interconnect ,                 Cray Inc./Hitachi                Japan Meteorological AgencyJapan",135792,5.73,9.13,1354
75,"Cray XC50, Xeon Platinum 8160  24C 2.1GHz, Aries interconnect ,                 Cray Inc./Hitachi                Japan Meteorological AgencyJapan",135792,5.73,9.13,1354
76,"COBRA - Intel Compute Module HNS2600BP, Xeon Gold 6148 20C 2.4GHz, Intel Omni-Path,                 Intel                Max-Planck-Gesellschaft MPI/IPPGermany",127520,5.61,9.79,1635
77,"Shaheen II - Cray XC40, Xeon E5-2698v3 16C 2.3GHz, Aries interconnect ,                 Cray/HPE                King Abdullah University of Science and TechnologySaudi Arabia",196608,5.54,7.24,2834
78,"Electra - HPE SGI 8600/SGI ICE-X, E5-2680V4/ Xeon Gold 6148 20C 2.4GHz, Infiniband EDR/FDR-56 IB,                 HPE                NASA/Ames Research Center/NASUnited States",124416,5.44,8.32,1686
79,"Raven - ThinkSystem SD650 V2, Xeon Platinum 8360Y 36C 2.4GHz, InfiniBand HDR 100,                 Lenovo                Max-Planck-Gesellschaft MPI/IPPGermany",114624,5.42,8.8,
80,"MAHTI - Bull Sequana XH2000 , AMD Rome 7H12 64C 2.6GHz, Mellanox HDR100,                 Atos                CSC (Center for Scientific Computing)Finland",169728,5.39,7.06,1070
81,"Pangea - SGI ICE X, Xeon Xeon E5-2670/ E5-2680v3 12C 2.5GHz, Infiniband FDR,                 HPE                Total Exploration ProductionFrance",220800,5.28,6.71,4150
82,"Berzelius - NVIDIA DGX A100, AMD EPYC 7742 64C 2.25GHz, NVIDIA A100, Infiniband HDR,                 Atos                National Supercomputer Centre (NSC)Sweden",59520,5.25,9.64,
83,"TX-GAIA (Green AI Accelerator) - Apollo 2000, Xeon Gold 6248 20C 2.5GHz, NVIDIA Tesla V100, Intel Omni-Path,                 HPE                MIT Lincoln Laboratory Supercomputing CenterUnited States",88400,5.16,6.98,1436
84,"BioHive-1 - NVIDIA DGX A100, AMD EPYC 7742 64C 2.25GHz, NVIDIA A100, Mellanox HDR Infiniband,                 Nvidia                RecursionUnited States",39680,4.9,5.71,
85,"Flow Type II subsystem - PRIMERGY CX2570 M5, Xeon Gold 6230 20C 2.1GHz, NVIDIA Tesla V100 SXM2, Infiniband EDR,                 Fujitsu                Information Technology Center, Nagoya UniversityJapan",79560,4.88,7.52,
86,"Eagle - HPE SGI 8600, Xeon Gold 6154 18C 3GHz, EDR Infiniband/ 8D Hypercube,                 HPE                National Renewable Energy LaboratoryUnited States",75600,4.85,7.26,
87,"Cheyenne - SGI ICE XA, Xeon E5-2697v4 18C 2.3GHz, Infiniband EDR,                 HPE                National Center for Atmospheric Research (NCAR)United States",144900,4.79,5.33,1727
88,"Betzy - Bull Sequana XH2000 , AMD EPYC 7742 64C 2.25GHz, Mellanox HDR Infiniband,                 Atos                UNINETT Sigma2 ASNorway",172032,4.72,6.19,
89,"PARAM Siddhi-AI - NVIDIA DGX A100, AMD EPYC 7742 64C 2.25GHz, NVIDIA A100, Mellanox HDR Infiniband,                 Atos                Center for Development of Advanced Computing (C-DAC)India",41664,4.62,5.27,
90,"ITO - Subsystem A - Fujitsu PRIMERGY CX2550/CX2560 M4, Xeon Gold 6154 18C 3GHz, Mellanox InfiniBand EDR,                 Fujitsu                Research Institute for Information Technology, Kyushu UniversityJapan",72000,4.54,6.91,
91,"Discoverer - BullSequana XH2000, AMD EPYC 7H12 64C 2.6GHz, Infiniband HDR,                 Atos                Consortium Petascale Supercomputer BulgariaBulgaria",144384,4.52,5.94,
92,"Jean Zay - HPE SGI 8600, Xeon Gold 6248 20C 2.5GHz, NVIDIA Tesla V100 SXM2, Intel Omni-Path,                 HPE                CNRS/IDRIS-GENCIFrance",93960,4.48,7.35,
93,"Wisteria/BDEC-01 (Aquarius) - PRIMERGY GX2570 M6, Xeon Platinum 8360Y 36C 2.4GHz, NVIDIA A100 SXM4 40 GB, Infiniband HDR,                 Fujitsu                Information Technology Center, The University of TokyoJapan",42120,4.42,7.27,184
94,"Atlas - Bull 4029GP-TVRT, Xeon Gold 6240 18C 2.6GHz, NVIDIA Tesla V100, Infiniband EDR,                 Atos                Petróleo Brasileiro S.ABrazil",91936,4.38,8.85,547
95,"Advanced Computing System(PreE) - Sugon TC8600, Hygon Dhyana  32C 2GHz, Deep Computing Processor, 200Gb 6D-Torus,                 Sugon                SugonChina",163840,4.33,6.13,380
96,"CRONOS - BullSequana X, Xeon Platinum 8260 24C 2.4GHz, Infiniband HDR,                 Atos                EDFFrance",81600,4.3,7.14,1226
97,"Oakbridge-CX - Fujitsu PRIMERGY CX2550/CX2560 M5, Xeon Platinum 8280 28C 2.7GHz, Intel Omni-Path,                 Fujitsu                Information Technology Center, The University of TokyoJapan",76608,4.29,6.62,845
98,"SNL/NNSA CTS-1 Manzano - Tundra Extreme Scale, Xeon Platinum 8268 24C 2.9GHz, Intel Omni-Path,                 Penguin Computing, Inc.                Sandia National LaboratoriesUnited States",71424,4.28,6.63,960
99,"Apollo 6500 XL270d Gen10, Xeon Gold 6140 18C 2.3GHz, Mellanox InfiniBand EDR, NVIDIA Tesla V100 SXM2,                 HPE                Research InstituteJapan",70416,4.13,5.78,
100,"Wilkes-3 - PowerEdge XE8545, AMD EPYC 7763 64C 2.45GHz, NVIDIA A100 80GB​, Infiniband HDR200 dual rail,                 DELL EMC                University of CambridgeUnited Kingdom",44800,4.12,6.64,147
