Rank,System,Cores,Rmax (TFlop/s),Rpeak (TFlop/s),Power (kW)
1,"Summit - IBM Power System AC922, IBM POWER9 22C 3.07GHz, NVIDIA Volta GV100, Dual-rail Mellanox EDR Infiniband,                 IBM                DOE/SC/Oak Ridge National LaboratoryUnited States",2282544,122300.0,187659.27,8806
2,"Sunway TaihuLight - Sunway MPP, Sunway SW26010 260C 1.45GHz, Sunway,                 NRCPC                National Supercomputing Center in WuxiChina",10649600,93014.59,125435.9,15371
3,"Sierra - IBM Power System S922LC, IBM POWER9 22C 3.1GHz, NVIDIA Volta GV100, Dual-rail Mellanox EDR Infiniband,                 IBM / NVIDIA / Mellanox                DOE/NNSA/LLNLUnited States",1572480,71610.0,119193.6,
4,"Tianhe-2A - TH-IVB-FEP Cluster, Intel Xeon E5-2692v2 12C 2.2GHz, TH Express-2, Matrix-2000,                 NUDT                National Super Computer Center in GuangzhouChina",4981760,61444.5,100678.66,18482
5,"AI Bridging Cloud Infrastructure (ABCI) - PRIMERGY CX2550 M4, Xeon Gold 6148 20C 2.4GHz, NVIDIA Tesla V100 SXM2, Infiniband EDR,                 Fujitsu                National Institute of Advanced Industrial Science and Technology (AIST)Japan",391680,19880.0,32576.63,1649
6,"Piz Daint - Cray XC50, Xeon E5-2690v3 12C 2.6GHz, Aries interconnect , NVIDIA Tesla P100,                 Cray/HPE                Swiss National Supercomputing Centre (CSCS)Switzerland",361760,19590.0,25326.26,2272
7,"Titan - Cray XK7, Opteron 6274 16C 2.200GHz, Cray Gemini interconnect, NVIDIA K20x,                 Cray/HPE                DOE/SC/Oak Ridge National LaboratoryUnited States",560640,17590.0,27112.55,8209
8,"Sequoia - BlueGene/Q, Power BQC 16C 1.60 GHz, Custom,                 IBM                DOE/NNSA/LLNLUnited States",1572864,17173.22,20132.66,7890
9,"Trinity - Cray XC40, Intel Xeon Phi 7250 68C 1.4GHz, Aries interconnect ,                 Cray/HPE                DOE/NNSA/LANL/SNLUnited States",979968,14137.3,43902.57,3844
10,"Cori - Cray XC40, Intel Xeon Phi 7250 68C 1.4GHz, Aries interconnect ,                 Cray/HPE                DOE/SC/LBNL/NERSCUnited States",622336,14014.7,27880.65,3939
11,"Nurion - Cray CS500, Intel Xeon Phi 7250 68C 1.4GHz, Intel Omni-Path,                 Cray/HPE                Korea Institute of Science and Technology InformationSouth Korea",570020,13929.3,25705.9,
12,"Oakforest-PACS - PRIMERGY CX1640 M1, Intel Xeon Phi 7250 68C 1.4GHz, Intel Omni-Path,                 Fujitsu                Joint Center for Advanced High Performance ComputingJapan",556104,13554.6,24913.46,2719
13,"HPC4 - Proliant DL380 Gen10, Xeon Platinum 8160  24C 2.1GHz, Mellanox InfiniBand EDR, NVIDIA Tesla P100,                 HPE                Eni S.p.A.Italy",253600,12210.0,18621.14,1320
14,"Tera-1000-2 - Bull Sequana X1000, Intel Xeon Phi 7250 68C 1.4GHz, Bull BXI 1.2,                 Atos                Commissariat a l'Energie Atomique (CEA)France",561408,11965.5,23396.35,3178
15,"Stampede2 - PowerEdge C6320P/C6420, Intel Xeon Phi 7250 68C 1.4GHz/Platinum 8160, Intel Omni-Path,                 DELL EMC                Texas Advanced Computing Center/Univ. of TexasUnited States",367024,10680.7,18309.22,
16,"K computer, SPARC64 VIIIfx 2.0GHz, Tofu interconnect,                 Fujitsu                RIKEN Advanced Institute for Computational Science (AICS)Japan",705024,10510.0,11280.38,12660
17,"Mira - BlueGene/Q, Power BQC 16C 1.60GHz, Custom,                 IBM                DOE/SC/Argonne National LaboratoryUnited States",786432,8586.61,10066.33,3945
18,"Marconi Intel Xeon Phi - CINECA Cluster, Lenovo SD530/S720AP, Intel Xeon Phi 7250 68C 1.4GHz/Platinum 8160, Intel Omni-Path,                 Lenovo                CINECAItaly",312936,8413.06,16212.93,
19,"TSUBAME3.0 - SGI ICE XA, IP139-SXM2, Xeon E5-2680v4 14C 2.4GHz, Intel Omni-Path, NVIDIA Tesla P100 SXM2,                 HPE                GSIC Center, Tokyo Institute of TechnologyJapan",135828,8125.0,12127.07,792
20,"Cray XC40, Xeon E5-2695v4 18C 2.1GHz, Aries interconnect ,                 Cray/HPE                United Kingdom Meteorological OfficeUnited Kingdom",241920,7038.93,8128.51,
21,"Theta - Cray XC40, Intel Xeon Phi 7230 64C 1.3GHz, Aries interconnect ,                 Cray/HPE                DOE/SC/Argonne National LaboratoryUnited States",280320,6920.9,11661.31,
22,"MareNostrum - Lenovo SD530, Xeon Platinum 8160 24C 2.1GHz, Intel Omni-Path,                 Lenovo                Barcelona Supercomputing CenterSpain",153216,6470.8,10296.11,1632
23,"JUWELS Module 1 - Bull Sequana X1000, Xeon Platinum 8168 24C 2.7GHz, Mellanox EDR InfiniBand/ParTec ParaStation ClusterSuite,                 Atos                Forschungszentrum Juelich (FZJ)Germany",114480,6177.73,9891.07,1361
24,"Pleiades - SGI ICE X, Intel Xeon E5-2670/E5-2680v2/E5-2680v3/E5-2680v4  2.6/2.8/2.5/2.4 GHz, Infiniband FDR,                 HPE                NASA/Ames Research Center/NASUnited States",241108,5951.55,7107.15,4407
25,"Cray XC50, Xeon Platinum 8160  24C 2.1GHz, Aries interconnect ,                 Cray Inc./Hitachi                Japan Meteorological AgencyJapan",135792,5730.5,9125.22,1354
26,"Cray XC50, Xeon Platinum 8160  24C 2.1GHz, Aries interconnect ,                 Cray Inc./Hitachi                Japan Meteorological AgencyJapan",135792,5730.5,9125.22,1354
27,"Hazel Hen - Cray XC40, Xeon E5-2680v3 12C 2.5GHz, Aries interconnect ,                 Cray/HPE                HLRS - Höchstleistungsrechenzentrum StuttgartGermany",185088,5640.17,7403.52,3615
28,"COBRA - Intel Compute Module HNS2600BP, Xeon Gold 6148 20C 2.4GHz, Intel Omni-Path,                 Intel                Max-Planck-Gesellschaft MPI/IPPGermany",127520,5612.83,9793.54,1635
29,"Shaheen II - Cray XC40, Xeon E5-2698v3 16C 2.3GHz, Aries interconnect ,                 Cray/HPE                King Abdullah University of Science and TechnologySaudi Arabia",196608,5536.99,7235.17,2834
30,"Pangea - SGI ICE X, Xeon Xeon E5-2670/ E5-2680v3 12C 2.5GHz, Infiniband FDR,                 HPE                Total Exploration ProductionFrance",220800,5283.11,6712.32,4150
31,"Cheyenne - SGI ICE XA, Xeon E5-2697v4 18C 2.3GHz, Infiniband EDR,                 HPE                National Center for Atmospheric Research (NCAR)United States",144900,4788.19,5332.32,1727
32,"ITO - Subsystem A - Fujitsu PRIMERGY CX2550/CX2560 M4, Xeon Gold 6154 18C 3GHz, Mellanox InfiniBand EDR,                 Fujitsu                Research Institute for Information Technology, Kyushu UniversityJapan",72000,4540.69,6912.0,
33,"Vulcan - BlueGene/Q, Power BQC 16C 1.600GHz, Custom Interconnect,                 IBM                DOE/NNSA/LLNLUnited States",393216,4293.31,5033.16,1972
34,"JOLIOT-CURIE SKL - Bull Sequana X1000, Xeon Platinum 8168 24C 2.7GHz, Mellanox EDR,                 Atos                CEA/TGCC-GENCIFrance",79488,4065.55,6635.52,917
35,"Abel - Cray XC30, Xeon E5-2698v3 16C 2.3GHz, Aries interconnect ,                 Cray/HPE                Petroleum Geo-ServicesUnited States",145920,4042.46,5369.86,1800
36,"Cray XC40, Xeon E5-2695v4 18C 2.1GHz, Aries interconnect ,                 Cray/HPE                ECMWFUnited Kingdom",126468,3944.68,4249.32,1897
37,"Cray XC40, Xeon E5-2695v4 18C 2.1GHz, Aries interconnect ,                 Cray/HPE                ECMWFUnited Kingdom",126468,3944.68,4249.32,1897
38,"JURECA - T-Platforms V-Class/Dell C6320P, E5-2680v3/Phi 7250-F, EDR/Intel Omni-Path/ParTec ParaStation, Tesla K80/K40,                 T-Platforms, Intel, Dell                Forschungszentrum Juelich (FZJ)Germany",155150,3782.57,6563.84,1345
39,"Pratyush - Cray XC40, Xeon E5-2695v4 18C 2.1GHz, Aries interconnect ,                 Cray/HPE                Indian Institute of Tropical MeteorologyIndia",119232,3763.94,4006.2,1353
40,"Cray CS-Storm, Intel Xeon E5-2660v2 10C 2.2GHz, Infiniband FDR, Nvidia K40,                 Cray/HPE                GovernmentUnited States",72800,3577.0,6131.84,1499
41,"Cray CS-Storm, Intel Xeon E5-2660v2 10C 2.2GHz, Infiniband FDR, Nvidia K40,                 Cray/HPE                GovernmentUnited States",72800,3577.0,6131.84,1499
42,"ONYX - Cray XC40, Intel Xeon Phi 7230 64C 1.3GHz/Xeon E5-2699v4, Aries interconnect ,                 Cray/HPE                ERDC DSRCUnited States",160304,3409.61,5865.52,
43,"Electra - HPE SGI 8600, SGI ICE-X, Xeon E5-2680V4/Gold 6148 20C 2.4GHz, Infiniband EDR,                 HPE                NASA/Ames Research Center/NASUnited States",78336,3328.59,4777.57,980
44,"Topaz - SGI ICE X, Xeon E5-2699v3 18C 2.3GHz, Infiniband FDR,                 HPE                ERDC DSRCUnited States",124200,3318.95,4570.56,5175
45,"NVIDIA DGX-1/Relion 2904GT, Xeon E5-2698v4 20C 2.2GHz/ E5-2650v4, Infiniband EDR, NVIDIA Tesla P100/Quadro GP100,                 Self-made                FacebookUnited States",60512,3307.0,4896.51,350
46,"DGX Saturn V - NVIDIA DGX-1, Xeon E5-2698v4 20C 2.2GHz, Infiniband EDR, NVIDIA Tesla P100,                 Nvidia                NVIDIA CorporationUnited States",60512,3307.0,4896.51,350
47,"Damson - Bull Sequana X1000, Xeon E5-2697v4 18C 2.3GHz, Infiniband EDR,                 Atos                AWEUnited Kingdom",113832,3243.41,3791.58,1134
48,"Mustang - HPE SGI 8600, Xeon Platinum 8168 24C 2.7GHz, Intel Omni-Path,                 HPE                Air Force Research LaboratoryUnited States",55296,3221.4,4777.57,
49,"HPC2 - iDataPlex DX360M4, Intel Xeon E5-2680v2  10C 2.8GHz, Infiniband FDR, NVIDIA K20x,                 IBM                Eni S.p.A.Italy",72000,3188.0,4605.0,1227
50,"SORA-MA - Fujitsu PRIMEHPC FX100, SPARC64 XIfx  32C 1.98GHz, Tofu interconnect 2,                 Fujitsu                Japan Aerospace eXploration AgencyJapan",110160,3157.0,3481.06,1652
51,"Cray XC30, Intel Xeon E5-2697v2 12C 2.7GHz, Aries interconnect ,                 Cray/HPE                GovernmentUnited States",225984,3143.52,4881.25,6328
52,"Thunder - SGI ICE X, Xeon E5-2699v3/E5-2697 v3, Infiniband FDR, NVIDIA Tesla K40, Intel Xeon Phi 7120P,                 HPE                Air Force Research LaboratoryUnited States",152692,3126.24,5610.48,4820
53,"Niagara - ThinkSystem SD530, Xeon Gold 6148 20C 2.4GHz, Infiniband EDR,                 Lenovo                SciNet/University of Toronto/Compute CanadaCanada",60000,3074.19,4608.0,676
54,"Camphor 2 - Cray XC40, Intel Xeon Phi 7250 68C 1.4GHz, Aries interconnect ,                 Cray/HPE                Academic Center for Computing and Media Studies (ACCMS),  Kyoto UniversityJapan",122400,3057.35,5483.52,748
55,"Mistral - bullx DLC 720, Xeon E5-2680v3 12C 2.5GHz/E5-2695V4 18C  2.1Ghz, Infiniband FDR,                 Atos                DKRZ - Deutsches KlimarechenzentrumGermany",99072,3010.68,3962.88,1116
56,"Fujitsu PRIMEHPC FX100, SPARC64 XIfx 32C 2.2GHz, Tofu interconnect 2,                 Fujitsu                Information Technology Center, Nagoya UniversityJapan",92160,2910.0,3244.03,1382
57,"SuperMUC - iDataPlex DX360M4, Xeon E5-2680 8C 2.70GHz, Infiniband FDR,                 IBM/Lenovo                Leibniz RechenzentrumGermany",147456,2897.0,3185.05,3423
58,"SuperMUC Phase 2 - NeXtScale nx360M5, Xeon E5-2697v3 14C 2.6GHz, Infiniband FDR14,                 Lenovo/IBM                Leibniz RechenzentrumGermany",86016,2813.62,3578.27,1481
59,"Cray XC40, Xeon E5-2695v4 18C 2.1GHz, Aries interconnect ,                 Cray/HPE                United Kingdom Meteorological OfficeUnited Kingdom",89856,2801.78,3019.16,1348
60,"Cray XC40, Xeon E5-2695v4 18C 2.1GHz, Aries interconnect ,                 Cray/HPE                United Kingdom Meteorological OfficeUnited Kingdom",89856,2801.78,3019.16,1348
61,"JFRS-1 - Cray XC50, Xeon Gold 6148 20C 2.4GHz, Aries interconnect ,                 Cray/HPE                Rokkasho Fusion Institute, National Institutes for Quantum and Radiological Science and TechnologyJapan",54560,2787.14,4190.21,698
62,"TSUBAME 2.5 - Cluster Platform SL390s G7, Xeon X5670 6C 2.93GHz, Infiniband QDR, NVIDIA K20x,                 NEC/HPE                GSIC Center, Tokyo Institute of TechnologyJapan",76032,2785.0,5735.69,1399
63,"LLNL/NNSA CTS-1 Jade - Tundra Extreme Scale, Xeon E5-2695v4 18C 2.1GHz, Intel Omni-Path,                 Penguin Computing, Inc.                Lawrence Livermore National LaboratoryUnited States",95472,2632.51,3207.86,13620
64,"LLNL CTS-1 Quartz - Tundra Extreme Scale, Xeon E5-2695v4 18C 2.1GHz, Intel Omni-Path,                 Penguin Computing, Inc.                Lawrence Livermore National LaboratoryUnited States",95472,2632.51,3207.86,13620
65,"HPC3 - Lenovo NeXtScale nx360M5, Xeon E5-2697v4 18C 2.3GHz, Infiniband EDR, NVIDIA Tesla K80,                 Lenovo                Energy Company (A)Italy",66000,2592.0,3798.6,
66,"Mihir - Cray XC40, Xeon E5-2695v4 18C 2.1GHz, Aries interconnect ,                 Cray/HPE                National Centre for Medium Range Weather ForecastingIndia",83592,2570.4,2808.69,955
67,"Tianhe-1A - NUDT YH MPP, Xeon X5670 6C 2.93 GHz, NVIDIA 2050,                 NUDT                National Supercomputing Center in TianjinChina",186368,2566.0,4701.0,4040
68,"PAI-BSystem - Sugon TC4600LP/W740I, Xeon Gold 6142 16C 2.6GHz, Infiniband EDR, NVIDIA Tesla P100,                 Sugon                China Meteorological AdministrationChina",50816,2547.0,4229.85,710
69,"cascade - Atipa Visione IF442 Blade Server, Xeon E5-2670 8C 2.600GHz, Infiniband FDR, Intel Xeon Phi 5110P,                 Atipa Technology                DOE/SC/Pacific Northwest National LaboratoryUnited States",194616,2539.13,3388.03,1384
70,"occigen2 - bullx DLC 720, Xeon E5-2690v4 14C 2.6GHz, Infiniband FDR,                 Atos                Grand Equipement National de Calcul Intensif - Centre Informatique National de l'Enseignement Suprieur (GENCI-CINES)France",85824,2494.65,3570.28,1430
71,"Excalibur - Cray XC40, Xeon E5-2698v3 16C 2.3GHz, Aries interconnect ,                 Cray/HPE                Army Research Laboratory DoD Supercomputing Resource Center (ARL DSRC)United States",100064,2485.0,3682.36,1466
72,"Lomonosov 2 - T-Platform A-Class Cluster, Xeon E5-2697v3 14C 2.6GHz,Intel Xeon Gold 6126, Infiniband FDR, Nvidia K40m/P-100,                 T-Platforms                Moscow State University - Research Computing CenterRussia",64384,2478.0,4946.79,
73,"Centennial - SGI ICE XA, Xeon E5-2698v4 20C 2.2GHz, Infiniband EDR,                 HPE                US Army Research Laboratory (ARL)United States",73920,2443.7,2601.98,835
74,"PAI-ASystem - Sugon TC4600, Xeon Gold 6142 16C 2.6GHz, Infiniband EDR,                 Sugon                China Meteorological AdministrationChina",48128,2435.0,4004.25,740
75,"Nuri - Cray XC40, Xeon E5-2690v3 12C 2.6GHz, Aries interconnect ,                 Cray/HPE                Korea Meteorological AdministrationSouth Korea",69600,2395.68,2895.36,1359
76,"Miri - Cray XC40, Xeon E5-2690v3 12C 2.6GHz, Aries interconnect ,                 Cray/HPE                Korea Meteorological AdministrationSouth Korea",69600,2395.68,2895.36,1359
77,"Plasma Simulator - Fujitsu PRIMEHPC FX100, SPARC64 XIfx  32C 1.98GHz, Tofu interconnect 2,                 Fujitsu                National Institute for Fusion Science (NIFS)Japan",82944,2376.0,2621.03,1244
78,"Makman-3 - PowerEdge R440/C6320p, Intel Xeon Phi 7250/Xeon Gold 6130 16C 2.1GHz, Intel Omni-Path,                 DELL EMC                Saudi AramcoSaudi Arabia",53300,2322.46,3581.76,608
79,"Inspur TS10000, Xeon Gold 6130 16C 2.1GHz, NVIDIA Tesla V100, 25G Ethernet,                 Inspur                Internet Service PChina",55104,2287.0,4890.0,
80,"Makman-2 - Dell PowerEdge R630, Xeon E5-2680v3 12C 2.5GHz, Infiniband QDR,                 DELL EMC                Saudi AramcoSaudi Arabia",76032,2249.68,3041.28,1134
81,"Prolix2 - bullx DLC 720, Xeon E5-2698v4 20C 2.2GHz, Infiniband FDR,                 Atos                Meteo FranceFrance",72000,2167.99,2534.4,830
82,"Beaufix2 - bullx DLC 720, Xeon E5-2698v4 20C 2.2GHz, Infiniband FDR,                 Atos                Meteo FranceFrance",73440,2157.41,2585.09,830
83,"ATERUI II  - Cray XC50, Xeon Gold 6148 20C 2.4GHz, Aries interconnect ,                 Cray/HPE                National Astronomical Observatory of JapanJapan",40000,2089.98,3072.0,496
84,"Tianhe-2 LvLiang Solution - Tianhe-2 LvLiang, Intel Xeon E5-2692v2 12C 2.2GHz, TH Express-2, Intel Xeon Phi 31S1P,                 NUDT                LvLiang Cloud Computing CenterChina",174720,2071.39,3074.53,997
85,"Koehr - HPE SGI 8600, Xeon Platinum 8168 24C 2.7GHz, Intel Omni-Path,                 HPE                Navy DSRCUnited States",34560,2001.99,2985.98,
86,"Gaffney - HPE SGI 8600, Xeon Platinum 8168 24C 2.7GHz, Intel Omni-Path,                 HPE                Navy DSRCUnited States",34560,2001.99,2985.98,
87,"Mogon II - NEC Cluster, Xeon Gold 6130 16C 2.1GHz, MEGWARE MiriQuid Xeon E5-2630v4, Intel Omni-Path,                 NEC/MEGWARE                Universitaet MainzGermany",49432,1967.81,2800.87,657
88,"Biowulf - Apollo 2000 Gen 8/9, Xeon E5-2680v4/E5-2695v3 14C 2.4GHz, Infiniband FDR,                 HPE                National Institutes of Health (NIH)United States",66304,1966.08,2491.37,
89,"SGI ICE X, Xeon E5-2680v3 12C 2.5GHz, Infiniband FDR,                 HPE                Japan Atomic Energy Agency (JAEA)Japan",60240,1929.37,2409.6,3012
90,"Tera-1000-1 - bullx DLC 720, Xeon E5-2698v3 16C 2.3GHz, Infiniband FDR,                 Atos                Commissariat a l'Energie Atomique (CEA)France",70272,1871.0,2586.01,1042
91,"scafellpike - Bull Sequana X1000, Intel Xeon Phi 7210 64C 1.3GHz/Xeon Gold 6142, Mellanox EDR,                 Atos                Science and Technology Facilities CouncilUnited Kingdom",80640,1829.86,4329.73,529
92,"Beskow - Cray XC40, Xeon E5-2695v4/E5-2698v3 16C 2.3GHz, Aries interconnect ,                 Cray/HPE                KTH - Royal Institute of TechnologySweden",67456,1802.51,2438.14,842
93,"Molecular Simulator - NEC LX Cluster, Xeon Gold 6148/6154, Intel Omni-Path,                 NEC                Institute for Molecular ScienceJapan",38552,1785.62,3072.77,544
94,"QURIOSITY - Apollo XL230k, Xeon Gold 6148 20C 2.4GHz, Intel Omni-Path,                 HPE                BASFGermany",35280,1750.18,2709.5,
95,"Inspur SA5212H5, Xeon Platinum 8163 24C 2.5GHz, 10G Ethernet,                 Inspur                Internet Service AChina",38400,1729.0,3072.0,
96,"Inspur SA5212H5, Xeon Platinum 8163 24C 2.5GHz, 10G Ethernet,                 Inspur                Internet Service AChina",38400,1729.0,3072.0,
97,"Inspur SA5212H5, Xeon Platinum 8163 24C 2.5GHz, 10G Ethernet,                 Inspur                Internet Service AChina",38400,1729.0,3072.0,
98,"Marconi Intel Xeon - Lenovo NeXtScale nx360M5, Xeon E5-2697v4 18C 2.3GHz, Omni-Path,                 Lenovo                CINECAItaly",54432,1723.89,2003.1,1361
99,"Inspur TS10000, Xeon E5-2682v4 16C 2.5GHz, 10G Ethernet, NVIDIA Tesla P100,                 Inspur                Internet Service AChina",39680,1714.0,3149.6,
100,"SwiftLucy - Cluster Platform 3000 BL460c Gen9, Xeon E5-2680v3 12C 2.5GHz, Infiniband FDR,                 HPE                GovernmentUnited States",57600,1703.28,2304.0,2880
