Rank,System,Cores,Rmax (PFlop/s),Rpeak (PFlop/s),Power (kW)
301,"Biowulf - Apollo 2000 Gen 8/9, Xeon E5-2680v4/E5-2695v3 14C 2.4GHz, Infiniband FDR,                 HPE                National Institutes of Health (NIH)United States",66304,1.97,2.49,
302,"Sugon TC6000, Xeon Gold 5118 12C 2.3GHz, 25G Ethernet, NVIDIA Tesla V100,                 Sugon                Energy CompanyChina",41280,1.96,3.6,245
303,"Sugon TC6000, Xeon Gold 6132 14C 2.6GHz, 25G Ethernet,                 Sugon                Telecom CompanyChina",47600,1.96,3.96,650
304,"Sugon TC6000, Xeon Gold 6140 18C 2.3GHz, 10G Ethernet,                 Sugon                State Grid CorpChina",53280,1.95,3.92,570
305,"Sugon TC6000, Xeon Gold 6130 16C 2.1GHz, 25G Ethernet,                 Sugon                IT Service ProviderChina",58112,1.93,3.91,630
306,"Inspur NF5468M5, Xeon Gold 6132 14C 2.6GHz, NVIDIA Tesla V100, 25G Ethernet,                 Inspur                Bank (J)China",51504,1.93,4.62,
307,"CTcluster - Sugon TC6000, Xeon Gold 6140 18C 2.3GHz, 10G Ethernet,                 Sugon                Telecom CompanyChina",54000,1.93,3.97,520
308,"Inspur TS10000, Xeon Gold 6130 16C 2.1GHz, NVIDIA Tesla V100, Infiniband EDR,                 Inspur                Internet CompanyChina",40320,1.92,3.52,
309,"ThinkSystem SR650, Xeon Gold 6138 20C 2GHz, 10G Ethernet,                 Lenovo                Financial Company PChina",57200,1.91,3.66,
310,"Huawei 2288H V5, Xeon Gold 6150 18C 2.7GHz, 10G Ethernet,                 Huawei Technologies Co., Ltd.                Energy CompanyChina",49680,1.91,4.29,733
311,"ThinkSystem SR650, Xeon E5-2698v3 16C 2.3GHz, 10G Ethernet,                 Lenovo                DJIT CompanyChina",86400,1.91,3.18,
312,"Sugon TC6000, Xeon Gold 6132 14C 2.6GHz, 25G Ethernet,                 Sugon                DJIT CompanyChina",46200,1.9,3.84,630
313,"Piz Daint Multicore - Cray XC40, Xeon E5-2695v4 18C 2.1GHz, Aries interconnect ,                 Cray/HPE                Swiss National Supercomputing Centre (CSCS)Switzerland",65268,1.9,2.19,732
314,"Sugon TC6000, Xeon Gold 6130 16C 2.1GHz, 25G Ethernet,                 Sugon                Internet CompanyChina",56800,1.9,3.82,625
315,"A1 - Lenovo HR650x, Xeon Gold 6148 20C 2.4GHz, 25G Ethernet,                 Lenovo                Service Provider TChina",47040,1.88,3.61,
316,"INSPUR SA5212M5, Xeon Gold 5117 14C 2GHz, NVIDIA Tesla V100, 10G Ethernet,                 Inspur                Internet Service (B)China",173680,1.87,15.16,
317,"Inspur TS10000, Xeon Gold 6130 16C 2.1GHz, NVIDIA Tesla V100, 25G Ethernet,                 Inspur                Internet Service PChina",40320,1.87,3.52,
318,"Tera-1000-1 - bullx DLC 720, Xeon E5-2698v3 16C 2.3GHz, Infiniband FDR,                 Atos                Commissariat a l'Energie Atomique (CEA)France",70272,1.87,2.59,1042
319,"HPE SGI 8600, Xeon Gold 6242R 20C 3.1GHz, Infiniband EDR,                 HPE                Japan Atomic Energy Agency(JAEA)/ National Institutes for Quantum and Radiological Science and Technology(QST)Japan",28240,1.87,2.8,
320,"ThinkSystem SR650, Xeon Gold 6248 20C 2.5GHz, 10G Ethernet,                 Lenovo                DJIT CompanyChina",44000,1.86,3.52,
321,"Inspur NF5468M5, Xeon Gold 5118 12C 2.3GHz, NVIDIA Tesla V100, 25G Ethernet,                 Inspur                Internet Service PChina",46480,1.85,4.08,
322,"Inspur TS10000, Xeon Gold 6248 20C 2.5GHz/Platinum 8268 24C 2.9GHz, NVIDIA Tesla V100, 100G Ethernet,                 Inspur                Nanjing UniversityChina",37440,1.85,3.43,
323,"Santos Dumont (SDumont) - Bull Sequana X1000, Xeon Gold 6252 24C 2.1GHz, Mellanox InfiniBand EDR, NVIDIA Tesla V100 SXM2,                 Atos                Laboratório Nacional de Computação CientíficaBrazil",33856,1.85,2.73,
324,"Phoenix - Relion XE2142/XE1114GT, Intel Xeon Gold 6226 12C 2.7GHz, NVIDIA Tesla V100, Mellanox InfiniBand HDR100,                 Penguin Computing, Inc.                Georgia Institute of TechnologyUnited States",31104,1.84,2.69,
325,"bsystem - Sugon TC6000, Xeon Gold 6130 16C 2.1GHz, 25G Ethernet,                 Sugon                Internet CompanyChina",55040,1.84,3.7,600
326,"ThinkSystem SR570, Xeon Gold 5218 16C 2.3GHz, 10G Ethernet,                 Lenovo                DJIT CompanyChina",83200,1.84,6.12,
327,"Sugon TC6000, Xeon Gold 6148 20C 2.4GHz, 25G Ethernet,                 Sugon                DJIT CompanyChina",48000,1.83,3.69,470
328,"Astra - Apollo 70, Marvell ThunderX2 ARM CN9975-2000  28C 2GHz, 4xEDR Infiniband,                 HPE                Sandia National LaboratoriesUnited States",143640,1.83,2.3,1193
329,"Sugon TC6000, Xeon Gold 5117 14C 2GHz, 25G Ethernet,                 Sugon                Internet Service (B)China",116200,1.83,7.44,1300
330,"Lenovo HR650x, Xeon Gold 6133 20C 2.5GHz, 25G Ethernet,                 Lenovo                Service Provider TChina",43200,1.83,3.46,
331,"scafellpike - Bull Sequana X1000, Intel Xeon Phi 7210 64C 1.3GHz/Xeon Gold 6142, Mellanox EDR,                 Atos                Science and Technology Facilities CouncilUnited Kingdom",80640,1.83,4.33,529
332,"ThinkSystem SR650, Xeon Gold 6138 20C 2GHz, 10G Ethernet, NVIDIA Tesla P100,                 Lenovo                Financial Company PChina",66080,1.83,4.98,
333,"JGV100System - Sugon TC6000, Xeon E5-2680v4 14C 2.4GHz, NVIDIA Tesla V100, 10G Ethernet,                 Sugon                Internet CompanyChina",41760,1.82,3.35,240
334,"Sugon TC6000, Xeon Gold 6132 14C 2.6GHz, 10G Ethernet,                 Sugon                IT Service ProviderChina",44100,1.82,3.67,600
335,"MN-3 - MN-Core Server, Xeon Platinum 8260M 24C 2.4GHz, Preferred Networks MN-Core, MN-Core DirectConnect,                 Preferred Networks                Preferred NetworksJapan",1664,1.82,3.14,61
336,"INSPUR SA5212M5, Xeon Gold 5117 14C 2GHz, NVIDIA Tesla V100, 10G Ethernet,                 Inspur                Internet Service (B)China",48880,1.82,4.14,
337,"INSPUR SA5212M5, Xeon Gold 5117 14C 2GHz, NVIDIA Tesla V100, 10G Ethernet,                 Inspur                Internet Service (B)China",48880,1.82,4.14,
338,"Sugon TC6000, Xeon Gold 6130 16C 2.1GHz, 25G Ethernet,                 Sugon                Government Agency (S)China",54240,1.81,3.64,600
339,"szaisystem - Sugon TC6000, Xeon Gold 6248 20C 2.5GHz, NVIDIA Tesla V100, Infiniband EDR,                 Sugon                Suzhou SC centerChina",30600,1.81,2.67,180
340,"Bank P A2 - ThinkSystem SR650, Xeon Gold 6148 20C 2.4GHz, NVIDIA Tesla V100, 10G Ethernet,                 Lenovo                Financial Company PChina",36000,1.81,3.02,
341,"Bank P A2 - ThinkSystem SR650, Xeon Gold 6148 20C 2.4GHz, NVIDIA Tesla V100, 10G Ethernet,                 Lenovo                Financial Company PChina",36000,1.81,3.02,
342,"JCSystem - Sugon TC6000, Xeon E5-2620v4 8C 2.1GHz, 10G Ethernet,                 Sugon                Internet CompanyChina",110080,1.81,3.7,1100
343,"S1 - ThinkSystem Flex SN550, Xeon Gold 6150 18C 2.7GHz, Infiniband FDR,                 Lenovo                GovernmentChina",33840,1.8,2.92,
344,"Beskow - Cray XC40, Xeon E5-2695v4/E5-2698v3 16C 2.3GHz, Aries interconnect ,                 Cray/HPE                KTH - Royal Institute of TechnologySweden",67456,1.8,2.44,842
345,"ESSystem - Sugon TC6000, Xeon E5-2630v4 10C 2.2GHz, 10G Ethernet,                 Sugon                State Grid CorpChina",105000,1.79,3.7,1100
346,"Molecular Simulator - NEC LX Cluster, Xeon Gold 6148/6154, Intel Omni-Path,                 NEC                Institute for Molecular ScienceJapan",38552,1.79,3.07,544
347,"R1 - ThinkSystem Flex SN550, Xeon Gold 6150 18C 2.7GHz, Infiniband FDR,                 Lenovo                GovernmentChina",33120,1.77,2.86,
348,"ThinkSystem SR570, Xeon Gold 5218 16C 2.3GHz, 10G Ethernet,                 Lenovo                DJIT CompanyChina",80000,1.77,5.89,
349,"Sugon TC6000, Xeon Gold 5118 12C 2.3GHz, 10G Ethernet,                 Sugon                Internet CompanyChina",99360,1.76,7.31,1320
350,"POD3 - Huawei Cluster, Xeon Gold 6148 20C 2.4GHz, Infiniband,                 Huawei Technologies Co., Ltd.                Group 42United Arab Emirates",34800,1.76,2.67,
351,"QURIOSITY - Apollo XL230k, Xeon Gold 6148 20C 2.4GHz, Intel Omni-Path,                 HPE                BASFGermany",35280,1.75,2.71,
352,"CARA - NEC LX Cluster, AMD Epyc 7601 32C 2.2GHz, Infiniband HDR,                 NEC                German Aerospace CenterGermany",145920,1.75,2.57,
353,"ThinkSystem SR590, Xeon E7-4850V3 14C 2.2GHz, 10G Ethernet,                 Lenovo                DJIT CompanyChina",2312800,1.74,81.41,
354,"CSystem - Sugon TC6000, Xeon Gold 5118 12C 2.3GHz, 10G Ethernet,                 Sugon                Telecom Operator (C)China",97920,1.74,7.21,1000
355,"Q1 - ThinkSystem Flex SN550, Xeon Gold 6150 18C 2.7GHz, Infiniband FDR,                 Lenovo                GovernmentChina",32400,1.74,2.8,
356,"Inspur SA5212H5, Xeon Platinum 8163 24C 2.5GHz, 10G Ethernet,                 Inspur                Internet Service AChina",38400,1.73,3.07,
357,"Inspur SA5212H5, Xeon Platinum 8163 24C 2.5GHz, 10G Ethernet,                 Inspur                Internet Service AChina",38400,1.73,3.07,
358,"Inspur SA5212H5, Xeon Platinum 8163 24C 2.5GHz, 10G Ethernet,                 Inspur                Internet Service AChina",38400,1.73,3.07,
359,"Internet Company T DD1 - Lenovo RD350, Xeon E5-2620v4 8C 2.1GHz, 10G Ethernet,                 Lenovo                Service Provider TChina",118400,1.73,3.98,
360,"Tryton Plus - CH121L V5 Liquid-Cooled, Xeon Platinum 8268 24C 2.9GHz, Infiniband EDR,                 Huawei Technologies Co., Ltd.                Gdansk University of Technology, CI TaskPoland",30432,1.73,2.82,307
361,"Huawei X6000, Xeon Gold 6242 16C 2.8GHz, Infiniband EDR,                 Huawei Technologies Co., Ltd.                Manufacturing Company BGermany",38400,1.72,3.44,655
362,"PRIMERGY CX2550 M4, Xeon Gold 6248 20C 2.5GHz, Intel Omni-Path,                 Fujitsu                Meteorological Research Institute, Japan Meteorological AgencyJapan",35200,1.72,2.82,
363,"Inspur TS10000, Xeon E5-2682v4 16C 2.5GHz, 10G Ethernet, NVIDIA Tesla P100,                 Inspur                Internet Service AChina",39680,1.71,3.15,
364,"Puhti - Bull Sequana X1000, Xeon Gold 6230 20C 2.1GHz, Mellanox HDR100,                 Atos                CSC (Center for Scientific Computing)Finland",40000,1.71,2.69,585
365,"P1 - ThinkSystem Flex SN550, Xeon Gold 6150 18C 2.7GHz, Infiniband FDR,                 Lenovo                GovernmentChina",31680,1.7,2.74,
366,"SwiftLucy - Cluster Platform 3000 BL460c Gen9, Xeon E5-2680v3 12C 2.5GHz, Infiniband FDR,                 HPE                GovernmentUnited States",57600,1.7,2.3,2880
367,"AFI-NITY - PRIMERGY CX2550 M4, Xeon Gold 6148 20C 2.4GHz, Infiniband EDR,                 Fujitsu                Tohoku University, Institute of Fluid ScienceJapan",35200,1.69,2.7,
368,"TaiYi - ThinkSystem SD530, Xeon Gold 6148 20C 2.4GHz, Intel Omni-Path,                 Lenovo                Southern University of Science and TechnologyChina",32400,1.69,2.49,
369,"ThinkSystem SD530, Xeon Gold 6148 20C 2.4GHz, Infiniband EDR,                 Lenovo                GovernmentChina",35200,1.68,2.7,
370,"ThinkSystem SD650, Xeon Gold 6240 18C 2.6GHz, Infiniband EDR,                 Lenovo                Beijing Meteorological AssociationChina",28800,1.68,2.7,
371,"ISystem - Sugon TC6000, Xeon E5-2650v4 12C 2.2GHz, 10G Ethernet,                 Sugon                IIT CompanyChina",97920,1.68,3.45,1050
372,"Internet Service D - Huawei 1288H V5, Xeon Platinum 8160  24C 2.1GHz, Infiniband EDR,                 Huawei Technologies Co., Ltd.                Internet Service JChina",48960,1.67,3.29,524
373,"Prometheus - HP Apollo 8000, Xeon E5-2680v3 12C 2.5GHz, Infiniband FDR, NVIDIA Tesla K40,                 HPE                CyfronetPoland",55728,1.67,2.35,808
374,"O1 - ThinkSystem Flex SN550, Xeon Gold 6150 18C 2.7GHz, Infiniband FDR,                 Lenovo                GovernmentChina",30960,1.67,2.67,
375,"ThinkSystem SR650, Xeon Gold 6148 20C 2.4GHz, 10G Ethernet,                 Lenovo                Internet CompanyChina",41760,1.67,3.21,
376,"Sugon TC6000, AMD Epyc 7501 32C 2GHz, AMD Vega 20, Infiniband HDR,                 Sugon                Pukou Advanced Computing CenterChina",100800,1.66,2.47,260
377,"Endeavor - Intel Cluster, Intel Xeon 6245/8280/6230/8268/8260L/8276/9242, Intel Omni-Path,                 Intel                IntelUnited States",31524,1.65,2.47,559
378,"Internet Company T Y1 - Lenovo RD450, Xeon E5-2680v4 14C 2.4GHz, 10G Ethernet,                 Lenovo                Service Provider TChina",89600,1.65,3.44,
379,"ThinkSystem SR570, Xeon E7-4850V3 14C 2.2GHz, 10G Ethernet,                 Lenovo                DJIT CompanyChina",78400,1.65,2.76,
380,"Software Company (M) AA1 - Lenovo C1040, Xeon E5-2673v4 20C 2.3GHz, 40G Ethernet,                 Lenovo                Cloud ProviderAustralia",57600,1.65,2.12,
381,"Software Company (M) CA3 - Lenovo C1040, Xeon E5-2673v4 20C 2.3GHz, 40G Ethernet,                 Lenovo                Cloud ProviderCanada",57600,1.65,2.12,
382,"Software Company (M) CA2 - Lenovo C1040, Xeon E5-2673v4 20C 2.3GHz, 40G Ethernet,                 Lenovo                Cloud ProviderCanada",57600,1.65,2.12,
383,"Software Company (M) CA1 - Lenovo C1040, Xeon E5-2673v4 20C 2.3GHz, 40G Ethernet,                 Lenovo                Cloud ProviderCanada",57600,1.65,2.12,
384,"Lenovo C1040, Xeon E5-2673v4 20C 2.3GHz, 40G Ethernet,                 Lenovo                Cloud ProviderCanada",57600,1.65,2.12,
385,"Software Company (M) A16 - Lenovo C1040, Xeon E5-2673v4 20C 2.3GHz, 40G Ethernet,                 Lenovo                Hosting ServicesUnited States",57600,1.65,2.12,
386,"Software Company (M) A15 - Lenovo C1040, Xeon E5-2673v4 20C 2.3GHz, 40G Ethernet,                 Lenovo                Hosting ServicesUnited States",57600,1.65,2.12,
387,"Software Company (M) A14 - Lenovo C1040, Xeon E5-2673v4 20C 2.3GHz, 40G Ethernet,                 Lenovo                Hosting ServicesUnited States",57600,1.65,2.12,
388,"Software Company (M) A13 - Lenovo C1040, Xeon E5-2673v4 20C 2.3GHz, 40G Ethernet,                 Lenovo                Hosting ServicesUnited States",57600,1.65,2.12,
389,"Software Company (M) A11 - Lenovo C1040, Xeon E5-2673v4 20C 2.3GHz, 40G Ethernet,                 Lenovo                Hosting ServicesUnited States",57600,1.65,2.12,
390,"Software Company (M) A10 - Lenovo C1040, Xeon E5-2673v4 20C 2.3GHz, 40G Ethernet,                 Lenovo                Hosting ServicesUnited States",57600,1.65,2.12,
391,"Software Company (M) A9 - Lenovo C1040, Xeon E5-2673v4 20C 2.3GHz, 40G Ethernet,                 Lenovo                Hosting ServicesUnited States",57600,1.65,2.12,
392,"Software Company (M) A8 - Lenovo C1040, Xeon E5-2673v4 20C 2.3GHz, 40G Ethernet,                 Lenovo                Hosting ServicesUnited States",57600,1.65,2.12,
393,"Software Company (M) A7 - Lenovo C1040, Xeon E5-2673v4 20C 2.3GHz, 40G Ethernet,                 Lenovo                Hosting ServicesUnited States",57600,1.65,2.12,
394,"Software Company (M) A6 - Lenovo C1040, Xeon E5-2673v4 20C 2.3GHz, 40G Ethernet,                 Lenovo                Hosting ServicesUnited States",57600,1.65,2.12,
395,"Software Company (M) A4 - Lenovo C1040, Xeon E5-2673v4 20C 2.3GHz, 40G Ethernet,                 Lenovo                Hosting ServicesUnited States",57600,1.65,2.12,
396,"Software Company (M) A3 - Lenovo C1040, Xeon E5-2673v4 20C 2.3GHz, 40G Ethernet,                 Lenovo                Hosting ServicesUnited States",57600,1.65,2.12,
397,"Software Company (M) A2 - Lenovo C1040, Xeon E5-2673v4 20C 2.3GHz, 40G Ethernet,                 Lenovo                Hosting ServicesUnited States",57600,1.65,2.12,
398,"Software Company (M) A1 - Lenovo C1040, Xeon E5-2673v4 20C 2.3GHz, 40G Ethernet,                 Lenovo                Hosting ServicesUnited States",57600,1.65,2.12,
399,"Software Company (M) A12 - Lenovo C1040, Xeon E5-2673v4 20C 2.3GHz, 40G Ethernet,                 Lenovo                Hosting ServicesUnited States",57600,1.65,2.12,
400,"Software Company (M) A5 - Lenovo C1040, Xeon E5-2673v4 20C 2.3GHz, 40G Ethernet,                 Lenovo                Hosting ServicesUnited States",57600,1.65,2.12,
